{"schema":1,"generated":"2026-10-30","source":"Atlas (Wikidata items, IGDB platforms, Aurore's ids)","platforms":{"switch":{"name":"Nintendo Switch","qid":"Q19610114","igdb":"switch","aurore":"switch","kind":"store"},"steam":{"name":"Steam","qid":"Q337535","igdb":"win","kind":"store"},"gog":{"name":"GOG","igdb":"win","kind":"store"},"xbox":{"name":"Xbox and Microsoft Store","qid":"Q13361286","igdb":"xboxone","kind":"store"},"3ds":{"name":"Nintendo 3DS","qid":"Q203597","igdb":"3ds","aurore":"3ds","kind":"console"},"nes":{"name":"Nintendo Entertainment System","qid":"Q172742","igdb":"nes","kind":"retro"},"fds":{"name":"Famicom Disk System","qid":"Q135321","igdb":"fds","kind":"retro"},"snes":{"name":"Super Nintendo Entertainment System","qid":"Q183259","igdb":"snes","kind":"retro"},"n64":{"name":"Nintendo 64","qid":"Q184839","igdb":"n64","kind":"retro"},"gamecube":{"name":"Nintendo GameCube","qid":"Q182172","igdb":"ngc","kind":"retro"},"wii":{"name":"Wii","qid":"Q8079","igdb":"wii","kind":"retro"},"wiiu":{"name":"Wii U","qid":"Q56942","igdb":"wiiu","kind":"retro"},"gb":{"name":"Game Boy","qid":"Q186437","igdb":"gb","kind":"retro"},"gbc":{"name":"Game Boy Color","qid":"Q203992","igdb":"gbc","kind":"retro"},"gba":{"name":"Game Boy Advance","qid":"Q188642","igdb":"gba","kind":"retro"},"nds":{"name":"Nintendo DS","qid":"Q170323","igdb":"nds","kind":"retro"},"ps1":{"name":"PlayStation","qid":"Q10677","igdb":"ps","kind":"retro"},"ps2":{"name":"PlayStation 2","qid":"Q10680","igdb":"ps2","kind":"retro"},"ps3":{"name":"PlayStation 3","qid":"Q10683","igdb":"ps3","kind":"retro"},"psp":{"name":"PlayStation Portable","qid":"Q170325","igdb":"psp","kind":"retro"},"psv":{"name":"PlayStation Vita","qid":"Q188808","igdb":"psvita","aurore":"psv","kind":"retro"},"xbox-og":{"name":"Xbox (2001)","qid":"Q132020","igdb":"xbox","kind":"retro"},"xbox360":{"name":"Xbox 360","qid":"Q48263","igdb":"xbox360","kind":"retro"},"sms":{"name":"Sega Master System","qid":"Q209868","igdb":"sms","kind":"retro"},"genesis":{"name":"Sega Genesis / Mega Drive","qid":"Q10676","igdb":"genesis-slash-megadrive","kind":"retro"},"segacd":{"name":"Sega CD / Mega-CD","qid":"Q1047516","igdb":"segacd","kind":"retro"},"gamegear":{"name":"Game Gear","qid":"Q751719","igdb":"gamegear","kind":"retro"},"saturn":{"name":"Sega Saturn","qid":"Q200912","igdb":"saturn","kind":"retro"},"dreamcast":{"name":"Dreamcast","qid":"Q184198","igdb":"dc","kind":"retro"},"atari2600":{"name":"Atari 2600","qid":"Q206261","igdb":"atari2600","kind":"retro"},"atarist":{"name":"Atari ST","qid":"Q627302","igdb":"atari-st","kind":"retro"},"colecovision":{"name":"ColecoVision","qid":"Q1046862","igdb":"colecovision","kind":"retro"},"turbografx16":{"name":"TurboGrafx-16 / PC Engine","qid":"Q1057377","igdb":"turbografx16--1","kind":"retro"},"neogeo":{"name":"Neo Geo","qid":"Q1054350","kind":"retro"},"3do":{"name":"3DO","qid":"Q229429","igdb":"3do","kind":"retro"},"cdi":{"name":"Philips CD-i","qid":"Q1023103","igdb":"philips-cd-i","kind":"retro"},"arcade":{"name":"Arcade","qid":"Q192851","igdb":"arcade","kind":"retro"},"c64":{"name":"Commodore 64","qid":"Q99775","igdb":"c64","kind":"retro"},"amiga":{"name":"Amiga","qid":"Q100047","igdb":"amiga","kind":"retro"},"zxspectrum":{"name":"ZX Spectrum","qid":"Q23882","igdb":"zxs","kind":"retro"},"amstradcpc":{"name":"Amstrad CPC","qid":"Q478829","igdb":"acpc","kind":"retro"},"msx":{"name":"MSX","qid":"Q853547","igdb":"msx","kind":"retro"},"apple2":{"name":"Apple II","qid":"Q3017175","igdb":"appleii","kind":"retro"},"dos":{"name":"MS-DOS","qid":"Q47604","kind":"retro"}}}
